url,note_title,note_date,surrounding_text,domain,extraction_confidence,note_quality_score,context_keywords
https://www.investopedia.com/retirement-planning,Retirement Planning Resources,2025-01-15 10:30:00,Check out this great resource for retirement planning strategies,investopedia.com,0.9,0.8,"retirement,planning,financial"
https://www.linkedin.com/learning/financial-literacy,Financial Literacy Course,2025-01-14 15:45:00,LinkedIn Learning course on financial literacy for professionals,linkedin.com,0.85,0.7,"financial,literacy,course,professional"
https://www.blackenterprise.com/wealth-building,Wealth Building for Black Professionals,2025-01-13 09:20:00,Excellent article on wealth building strategies for African American professionals,blackenterprise.com,0.95,0.9,"wealth,building,black,professionals,african american"
https://www.healthline.com/mental-health/work-life-balance,Work-Life Balance for Professionals,2025-01-12 14:15:00,Important article about maintaining work-life balance and family relationships,healthline.com,0.88,0.75,"work,life,balance,family,relationships,health"
https://www.faithandfinance.org/investing-with-purpose,Faith-Based Investment Strategies,2025-01-11 11:30:00,Great resource for combining faith values with investment decisions,faithandfinance.org,0.92,0.85,"faith,investment,values,purpose,spirituality"
https://www.parenting.com/financial-planning-for-families,Financial Planning for Families with Kids,2025-01-10 16:45:00,Essential guide for financial planning when you have children,parenting.com,0.87,0.8,"financial,planning,family,kids,children"
